{
  "$schema": "http://json-schema.org/draft-07/schema#",
  "$id": "https://srd-builder.example.com/schemas/magic_item.schema.json",
  "version": "2.0.0",
  "title": "Magic Item",
  "description": "Schema for D&D 5e SRD magic items",
  "type": "object",
  "required": [
    "id",
    "name",
    "simple_name",
    "type",
    "rarity",
    "requires_attunement",
    "description",
    "page",
    "source"
  ],
  "additionalProperties": false,
  "properties": {
    "id": {
      "type": "string",
      "description": "Unique identifier (slugified name with magic_item: prefix)",
      "pattern": "^magic_item:[a-z0-9_]+$"
    },
    "name": {
      "type": "string",
      "description": "Full item name as it appears in SRD",
      "minLength": 1
    },
    "simple_name": {
      "type": "string",
      "description": "Simplified name for cross-referencing (lowercase, underscore-separated)",
      "pattern": "^[a-z0-9_]+$"
    },
    "aliases": {
      "type": "array",
      "description": "Alternative names or search terms for discoverability",
      "items": {
        "type": "string",
        "minLength": 1
      }
    },
    "type": {
      "type": "string",
      "description": "Item type (Armor, Weapon, Wondrous item, Potion, etc.)",
      "minLength": 1
    },
    "rarity": {
      "type": "string",
      "description": "Item rarity tier",
      "enum": [
        "common",
        "uncommon",
        "rare",
        "very rare",
        "legendary",
        "artifact",
        "varies"
      ]
    },
    "requires_attunement": {
      "type": "boolean",
      "description": "Whether the item requires attunement to use"
    },
    "attunement_requirements": {
      "type": "string",
      "description": "Specific requirements for attunement (e.g., 'by a spellcaster', 'by a cleric or paladin')"
    },
    "description": {
      "type": "array",
      "description": "Item description as array of paragraphs",
      "minItems": 1,
      "items": {
        "type": "string",
        "minLength": 1
      }
    },
    "summary": {
      "type": "string",
      "description": "Optional one-sentence summary of the item's primary effect"
    },
    "variant_of": {
      "type": "string",
      "description": "Base item ID if this is a variant (e.g., '+1 longsword' variant_of 'equipment:longsword')"
    },
    "page": {
      "type": "integer",
      "description": "PDF page number where this item appears",
      "minimum": 1
    },
    "source": {
      "type": "string",
      "description": "Source document identifier (e.g., 'SRD_CC_v5.1')",
      "minLength": 1
    }
  }
}
