{
  "id": "magic_item:example",
  "name": "example name",
  "simple_name": "example",
  "type": "example type",
  "rarity": "common",
  "requires_attunement": false,
  "description": [
    "example description"
  ],
  "page": 1,
  "source": "example source",
  "aliases": [
    "example aliases"
  ],
  "attunement_requirements": "example attunement_requirements",
  "summary": "example summary",
  "variant_of": "example variant_of"
}
